Exp 2
DML commands-INSERT
//table person
insert values in  person table.


mysql> insert into person values(101,"Anu","banglore",2002,0987654321);
Query OK, 1 row affected (0.01 sec)

mysql> insert into person values(102,"Banu","goa",2000,1234567890);
Query OK, 1 row affected (0.01 sec)

mysql> insert into person values(103,"sanu","delhi",2001,6543217890);
Query OK, 1 row affected (0.01 sec)

mysql> insert into person values(104,"finu","mumbai",2003,2143658709);
Query OK, 1 row affected (0.00 sec)

mysql> insert into person values(105,"janu","chennai",2005,8765432190);
Query OK, 1 row affected (0.00 sec)

mysql> select * from person;
+------+------+----------+------+------------+
| ssn  | name | city     | dob  | adhar_no   |
+------+------+----------+------+------------+
|  101 | Anu  | banglore | 2002 |  987654321 |
|  102 | Banu | goa      | 2000 | 1234567890 |
|  103 | sanu | delhi    | 2001 | 6543217890 |
|  104 | finu | mumbai   | 2003 | 2143658709 |
|  105 | janu | chennai  | 2005 | 8765432190 |
+------+------+----------+------+------------+
5 rows in set (0.00 sec)


  *************************************************


//table student
insert values in student table

mysql> insert into student values(01,"zusa",10,"abc house","F");
Query OK, 1 row affected (0.01 sec)

mysql> insert into student values(02,"suku",20,"pqr house","M");
Query OK, 1 row affected (0.01 sec)

mysql> insert into student values(03,"kukku",5,"lmn house","F");
Query OK, 1 row affected (0.01 sec)

mysql> insert into student values(04,"akku",2,"ghi house","M");
Query OK, 1 row affected (0.01 sec)

mysql> insert into student values(05,"nichu",22,"xyz house","M");
Query OK, 1 row affected (0.00 sec)

mysql> select * from student;
+---------+-------+------+-----------+--------+
| roll_no | name  | age  | address   | gender |
+---------+-------+------+-----------+--------+
|       1 | zusa  |   10 | abc house | F      |
|       2 | suku  |   20 | pqr house | M      |
|       3 | kukku |    5 | lmn house | F      |
|       4 | akku  |    2 | ghi house | M      |
|       5 | nichu |   22 | xyz house | M      |
+---------+-------+------+-----------+--------+
5 rows in set (0.00 sec)


   *************************************************************



insert values into invoice database
//table customer

mysql> insert into customer values(10001,"john","grand villa","calicut",9876543212);
Query OK, 1 row affected (0.01 sec)

mysql> insert into customer values(10002,"smith","grace villa","ekm",3456789012);
Query OK, 1 row affected (0.01 sec)

mysql> insert into customer values(10003,"susan","zeno villa","tvm",9765438976);
Query OK, 1 row affected (0.01 sec)

mysql> insert into customer values(10004,"adam","white villa","pkd",9543678965);
Query OK, 1 row affected (0.01 sec)

mysql> insert into customer values(10005,"blessy","grey house","wyd",8976543214);
Query OK, 1 row affected (0.01 sec)

mysql> select * from customer;
+-------+--------+-------------+---------+------------+
| id    | name   | address     | city    | ph_no      |
+-------+--------+-------------+---------+------------+
| 10001 | john   | grand villa | calicut | 9876543212 |
| 10002 | smith  | grace villa | ekm     | 3456789012 |
| 10003 | susan  | zeno villa  | tvm     | 9765438976 |
| 10004 | adam   | white villa | pkd     | 9543678965 |
| 10005 | blessy | grey house  | wyd     | 8976543214 |
+-------+--------+-------------+---------+------------+
5 rows in set (0.00 sec)

mysql> delete from customer where id=10003;
Query OK, 1 row affected (0.00 sec)

mysql> insert into customer(id,name,address,city) values(10003,"susan","zeno villa","tvm");
Query OK, 1 row affected (0.01 sec)

mysql> select * from customer;
+-------+--------+-------------+---------+------------+
| id    | name   | address     | city    | ph_no      |
+-------+--------+-------------+---------+------------+
| 10001 | john   | grand villa | calicut | 9876543212 |
| 10002 | smith  | grace villa | ekm     | 3456789012 |
| 10003 | susan  | zeno villa  | tvm     |       NULL |
| 10004 | adam   | white villa | pkd     | 9543678965 |
| 10005 | blessy | grey house  | wyd     | 8976543214 |
+-------+--------+-------------+---------+------------+
5 rows in set (0.00 sec)

//table product

mysql> desc product;
+-------+-------------+------+-----+---------+-------+
| Field | Type        | Null | Key | Default | Extra |
+-------+-------------+------+-----+---------+-------+
| pid   | int         | NO   | PRI | NULL    |       |
| pname | varchar(25) | YES  |     | NULL    |       |
| price | int         | YES  |     | 0       |       |
+-------+-------------+------+-----+---------+-------+
3 rows in set (0.01 sec)

mysql> insert into product values(301,"pen",10);
Query OK, 1 row affected (0.01 sec)

mysql> insert into product values(401,"pencil",50);
Query OK, 1 row affected (0.01 sec)

mysql> insert into product values(501,"soap",70);
Query OK, 1 row affected (0.01 sec)

mysql> insert into product values(601,"book",100);
Query OK, 1 row affected (0.01 sec)

mysql> insert into product values(701,"bucket",150);
Query OK, 1 row affected (0.01 sec)

mysql> select * from product;
+-----+--------+-------+
| pid | pname  | price |
+-----+--------+-------+
| 301 | pen    |    10 |
| 401 | pencil |    50 |
| 501 | soap   |    70 |
| 601 | book   |   100 |
| 701 | bucket |   150 |
+-----+--------+-------+
5 rows in set (0.00 sec)


       ***************************************************


mysql> insert into invoice_master values(101,10001,20211126);
Query OK, 1 row affected (0.02 sec)

mysql> insert into invoice_master values(102,10002,20211126);
Query OK, 1 row affected (0.01 sec)

mysql> insert into invoice_master values(103,10003,20220211);
Query OK, 1 row affected (0.01 sec)

mysql> insert into invoice_master values(104,10004,20230125);
Query OK, 1 row affected (0.01 sec)

mysql> insert into invoice_master values(105,10004,20210810);
Query OK, 1 row affected (0.01 sec)

mysql> select * from invoice_master;
+--------+---------+------------+
| inv_id | cust_id | inv_date   |
+--------+---------+------------+
|    101 |   10001 | 2021-11-26 |
|    102 |   10002 | 2021-11-26 |
|    103 |   10003 | 2022-02-11 |
|    104 |   10004 | 2023-01-25 |
|    105 |   10004 | 2021-08-10 |
+--------+---------+------------+


mysql> insert into invoice_item values(101,301,10);
Query OK, 1 row affected (0.01 sec)

mysql> insert into invoice_item values(102,401,1);
Query OK, 1 row affected (0.00 sec)

mysql> insert into invoice_item values(102,501,3);
Query OK, 1 row affected (0.00 sec)

mysql> insert into invoice_item values(103,601,15);
Query OK, 1 row affected (0.00 sec)

mysql> insert into invoice_item values(104,701,20);
Query OK, 1 row affected (0.00 sec)

mysql> insert into invoice_item values(105,701,1);
Query OK, 1 row affected (0.01 sec)

mysql> select * from invoice_item;
+--------+------+----------+
| inv_id | pid  | quantity |
+--------+------+----------+
|    101 |  301 |       10 |
|    102 |  401 |        1 |
|    102 |  501 |        3 |
|    103 |  601 |       15 |
|    104 |  701 |       20 |
|    105 |  701 |        1 |
+--------+------+----------+

mysql> select * from invoice_item;
+--------+------+----------+
| inv_id | pid  | quantity |
+--------+------+----------+
|    101 |  301 |       10 |
|    102 |  401 |        1 |
|    102 |  501 |        3 |
|    103 |  601 |       15 |
|    104 |  701 |       20 |
|    105 |  701 |        1 |
+--------+------+----------+
6 rows in set (0.00 sec)

mysql> delete from invoice_item where pid=501;
Query OK, 1 row affected (0.00 sec)

mysql> select * from invoice_item;
+--------+------+----------+
| inv_id | pid  | quantity |
+--------+------+----------+
|    101 |  301 |       10 |
|    102 |  401 |        1 |
|    103 |  601 |       15 |
|    104 |  701 |       20 |
|    105 |  701 |        1 |
+--------+------+----------+

    *****************************************************

DML COMMANDS-UPDATE
update the price of a particular product.

mysql> update product set price=220 where pid=701;
Query OK, 1 row affected (0.01 sec)
Rows matched: 1  Changed: 1  Warnings: 0

mysql> select * from product;
+-----+--------+-------+
| pid | pname  | price |
+-----+--------+-------+
| 301 | pen    |    10 |
| 401 | pencil |    50 |
| 501 | soap   |    70 |
| 601 | book   |   100 |
| 701 | bucket |   220 |
+-----+--------+-------+


mysql> update customer set city="kozhikode" where city="calicut";
Query OK, 1 row affected (0.01 sec)
Rows matched: 1  Changed: 1  Warnings: 0

mysql> select * from customer;
+-------+--------+-------------+-----------+------------+
| id    | name   | address     | city      | ph_no      |
+-------+--------+-------------+-----------+------------+
| 10001 | john   | grand villa | kozhikode | 9876543212 |
| 10002 | smith  | grace villa | ekm       | 3456789012 |
| 10003 | susan  | zeno villa  | tvm       |       NULL |
| 10004 | adam   | white villa | pkd       | 9543678965 |
| 10005 | blessy | grey house  | wyd       | 8976543214 |
+-------+--------+-------------+-----------+------------+


//update all prices with 2% of its original price

mysql> select * from product;
+-----+--------+-------+
| pid | pname  | price |
+-----+--------+-------+
| 301 | pen    |    10 |
| 401 | pencil |    50 |
| 501 | soap   |    70 |
| 601 | book   |   100 |
| 701 | bucket |   220 |
+-----+--------+-------+
5 rows in set (0.00 sec)

mysql> update product set price=price+(price*2/100);
Query OK, 4 rows affected (0.01 sec)
Rows matched: 5  Changed: 4  Warnings: 0

mysql> select * from product;
+-----+--------+-------+
| pid | pname  | price |
+-----+--------+-------+
| 301 | pen    |    10 |
| 401 | pencil |    51 |
| 501 | soap   |    71 |
| 601 | book   |   102 |
| 701 | bucket |   224 |
+-----+--------+-------+
 
 
      *******************************************

//change the address,city,phone number of a particular customer.
mysql> select * from customer;
+-------+--------+-------------+-----------+------------+
| id    | name   | address     | city      | ph_no      |
+-------+--------+-------------+-----------+------------+
| 10001 | john   | grand villa | kozhikode | 9876543212 |
| 10002 | smith  | grace villa | ekm       | 3456789012 |
| 10003 | susan  | zeno villa  | tvm       |       NULL |
| 10004 | adam   | white villa | pkd       | 9543678965 |
| 10005 | blessy | grey house  | wyd       | 8976543214 |
+-------+--------+-------------+-----------+------------+
5 rows in set (0.00 sec)

mysql> update customer set address="blue villa",city="idukki",ph_no=9895521927 where id=10004;
Query OK, 1 row affected (0.01 sec)
Rows matched: 1  Changed: 1  Warnings: 0

mysql> select * from customer;
+-------+--------+-------------+-----------+------------+
| id    | name   | address     | city      | ph_no      |
+-------+--------+-------------+-----------+------------+
| 10001 | john   | grand villa | kozhikode | 9876543212 |
| 10002 | smith  | grace villa | ekm       | 3456789012 |
| 10003 | susan  | zeno villa  | tvm       |       NULL |
| 10004 | adam   | blue villa  | idukki    | 9895521927 |
| 10005 | blessy | grey house  | wyd       | 8976543214 |
+-------+--------+-------------+-----------+------------+


      ********************************
      
      
//change the quantity of a product of inv_id=101

mysql> select * from invoice_item;
+--------+------+----------+
| inv_id | pid  | quantity |
+--------+------+----------+
|    101 |  301 |       10 |
|    102 |  401 |        1 |
|    103 |  601 |       15 |
|    104 |  701 |       20 |
|    105 |  701 |        1 |
+--------+------+----------+
5 rows in set (0.00 sec)

mysql> update invoice_item set quantity=6 where inv_id=101;
Query OK, 1 row affected (0.00 sec)
Rows matched: 1  Changed: 1  Warnings: 0

mysql> select * from invoice_item;
+--------+------+----------+
| inv_id | pid  | quantity |
+--------+------+----------+
|    101 |  301 |        6 |
|    102 |  401 |        1 |
|    103 |  601 |       15 |
|    104 |  701 |       20 |
|    105 |  701 |        1 |
+--------+------+----------+
5 rows in set (0.00 sec)

------------------------------------------------------------

DML commands -DELETE

deletet he record of customer id 101.

mysql> set foreign_key_checks=0;
Query OK, 0 rows affected (0.00 sec)

mysql> delete from customer where id=10001;
Query OK, 1 row affected (0.01 sec)

mysql> select * from customer;
+-------+--------+-------------+--------+------------+
| id    | name   | address     | city   | ph_no      |
+-------+--------+-------------+--------+------------+
| 10002 | smith  | grace villa | ekm    | 3456789012 |
| 10003 | susan  | zeno villa  | tvm    |       NULL |
| 10004 | adam   | blue villa  | idukki | 9895521927 |
| 10005 | blessy | grey house  | wyd    | 8976543214 |
+-------+--------+-------------+--------+------------+


//delete all purchase details of items its quantity less than 2


mysql> select * from invoice_item;
+--------+------+----------+
| inv_id | pid  | quantity |
+--------+------+----------+
|    101 |  301 |        6 |
|    102 |  401 |        1 |
|    103 |  601 |       15 |
|    104 |  701 |       20 |
|    105 |  701 |        1 |
+--------+------+----------+

mysql> delete from invoice_item where quantity<2;
Query OK, 2 rows affected (0.01 sec)

mysql> select * from invoice_item;
+--------+------+----------+
| inv_id | pid  | quantity |
+--------+------+----------+
|    101 |  301 |        6 |
|    103 |  601 |       15 |
|    104 |  701 |       20 |
+--------+------+----------+


// delete the purchase details of product "pen" where inv_id=10001


 mysql> select * from invoice_item;
+--------+------+----------+
| inv_id | pid  | quantity |
+--------+------+----------+
|    101 |  301 |        6 |
|    103 |  601 |       15 |
|    104 |  701 |       20 |
+--------+------+----------+
3 rows in set (0.01 sec)

mysql> select * from product;
+-----+--------+-------+
| pid | pname  | price |
+-----+--------+-------+
| 301 | pen    |    10 |
| 401 | pencil |    51 |
| 501 | soap   |    71 |
| 601 | book   |   102 |
| 701 | bucket |   224 |
+-----+--------+-------+
5 rows in set (0.00 sec)

mysql> delete from invoice_item where inv_id=101 and pid=301;
Query OK, 1 row affected (0.00 sec)

mysql> select * from invoice_item;
+--------+------+----------+
| inv_id | pid  | quantity |
+--------+------+----------+
|    103 |  601 |       15 |
|    104 |  701 |       20 |
+--------+------+----------+


//

 mysql> select * from customer;
+-------+--------+-------------+--------+------------+
| id    | name   | address     | city   | ph_no      |
+-------+--------+-------------+--------+------------+
| 10002 | smith  | grace villa | ekm    | 3456789012 |
| 10003 | susan  | zeno villa  | tvm    |       NULL |
| 10004 | adam   | blue villa  | idukki | 9895521927 |
| 10005 | blessy | grey house  | wyd    | 8976543214 |
+-------+--------+-------------+--------+------------+

mysql> set foreign_key_checks=0;
Query OK, 0 rows affected (0.00 sec)

mysql> delete from customer where id=10003;
Query OK, 1 row affected (0.01 sec)

mysql> select * from customer;
+-------+--------+-------------+--------+------------+
| id    | name   | address     | city   | ph_no      |
+-------+--------+-------------+--------+------------+
| 10002 | smith  | grace villa | ekm    | 3456789012 |
| 10004 | adam   | blue villa  | idukki | 9895521927 |
| 10005 | blessy | grey house  | wyd    | 8976543214 |
+-------+--------+-------------+--------+------------+


  ****************************************
  
//delete all records from table.
//table student

mysql> use exp1;
Reading table information for completion of table and column names
You can turn off this feature to get a quicker startup with -A

Database changed
mysql> select * from student;
+---------+-------+------+-----------+--------+
| roll_no | name  | age  | address   | gender |
+---------+-------+------+-----------+--------+
|       1 | zusa  |   10 | abc house | F      |
|       2 | suku  |   20 | pqr house | M      |
|       3 | kukku |    5 | lmn house | F      |
|       4 | akku  |    2 | ghi house | M      |
|       5 | nichu |   22 | xyz house | M      |
+---------+-------+------+-----------+--------+
5 rows in set (0.00 sec)

mysql> delete from student;
Query OK, 5 rows affected (0.01 sec)

mysql> select * from student;
Empty set (0.00 sec)


//delete invoice details of a particular customer

mysql> select * from customer;
+-------+--------+-------------+--------+------------+
| id    | name   | address     | city   | ph_no      |
+-------+--------+-------------+--------+------------+
| 10002 | smith  | grace villa | ekm    | 3456789012 |
| 10004 | adam   | blue villa  | idukki | 9895521927 |
| 10005 | blessy | grey house  | wyd    | 8976543214 |
+-------+--------+-------------+--------+------------+

mysql> delete from customer where id=10002;
Query OK, 1 row affected (0.01 sec)

mysql> select * from customer;
+-------+--------+------------+--------+------------+
| id    | name   | address    | city   | ph_no      |
+-------+--------+------------+--------+------------+
| 10004 | adam   | blue villa | idukki | 9895521927 |
| 10005 | blessy | grey house | wyd    | 8976543214 |
+-------+--------+------------+--------+------------+



//delete the first 2 record of invoice_item table its purchase quantity is high

mysql> select * from invoice_item;
+--------+------+----------+
| inv_id | pid  | quantity |
+--------+------+----------+
|    103 |  601 |       15 |
|    104 |  701 |       20 |
+--------+------+----------+

mysql> delete from invoice_item where quantity=20;
Query OK, 1 row affected (0.01 sec)

mysql> select * from invoice_item;
+--------+------+----------+
| inv_id | pid  | quantity |
+--------+------+----------+
|    103 |  601 |       15 |
+--------+------+----------+

